{"schema_version":1,"name":"control-plane-ledger-appendable","phase":"Control Plane Phase 2","pass_condition":"SP.ControlPlane.Ledger.verify/1 returns :ok over a chain built only through SP.ControlPlane.Command.","falsifies_condition":"verify/1 returns :ok after any past entry is edited, deleted, or re-sequenced.","receipt_path":"docs/GATES.md","pre_registration_path":"","verdict":"PENDING","evidence_class":"pending","last_updated":"2026-07-25","notes":"FIXTURE ONLY — never appended to evidence/gates.ndjson. Used by test/sp/control_plane/*."}
